<?xml version="1.0" encoding="UTF-8"?> 
<!-- 25x version -->
<derivedformatmanagement xmlns:xsi="http://www.w3.org/2001/XMLSchema-instance" xsi:noNamespaceSchemaLocation="DerivedFormatDeclarative.xsd">
	<converter name="3DEXPERIENCE" synchronous="false" nlsFile="emxDerivedFormatManagementStringResource" comment="all the conversion managed asynchronously by DS, By DerivedFormatConverter (OnTheEdge DO converter) or Conversion Service" >
		<datasources>
			<!-- =============================== Native 3DSEXPERIENCE==============================================================================  -->
			<datasource name="3DEXPERIENCE">
				<source name="CATPart" type = "Part">
					<target name="XCADPivot" inputStreamId="authoring" outputStreamId="XCADPivot" downloadable="false" conversionService="true"/>
					<!-- For Step_Pivot, all parameters are hardcoded -->
					<target name="STEP" inputStreamId="authoring" outputStreamId="*" downloadable="true" conversionService="true">
						<!-- STEP Parameters are coming from CATSettings on Converter Machine - Default Level AP242   * Add AP242 Ed4 from 26xFD01 -->						
						<parameter name="ApplicationProtocol" values="AP203|AP203E2|AP214|AP214E3|AP242E1|AP242E2|AP242E3|AP242E4"  type="enum" default="AP242E1" description="Specifies the STEP format into which the data will be exported as explained in Dealing with STEP Data" mandatory="true"/>
						<parameter name="3DAnnotations" values="none|graphic|authoring" type="enum" default="none" description="with PMI. 'authoring' value requires role" />
						<parameter name="Composites" 			values="true|false" type="enum" default="false" 	description="At least one Composites Design app required" />
						<parameter name="UserDefinedAttributes" values="true|false" type="enum" default="false" 	description="" />
						<parameter name="ValidationProperties"  values="true|false" type="enum" default="false" 	description="" />
						<!--  new STEP parameters from 25xFD03 -->
						<parameter name="Groups"  				values="true|false" type="enum" default="false" 	description="" />
						<parameter name="Units"  				values="mm|inch" 	type="enum" default="mm" 		description="units : metric or imperial" />
						<parameter name="GeometricalSets"  		values="true|false" type="enum" default="false" 	description="" />
						<parameter name="ExactGeometry"  		values="exact|tessellated|both" type="enum" default="exact" description="" />
						<parameter name="ExportAlsoEdges"  		values="true|false" type="enum" default="false" 	description="" />
						<parameter name="ExportAlsoNoShowEntities"  values="true|false" type="enum" default="false" 	description="" />
						<parameter name="ExportAlsoNonVisualizedLayers"  values="true|false" type="enum" default="false" 	description="" />
					</target>
					<!-- BELOW MUST be target name=CATPart...but impact to manage   can use conv Service from 23xFD03-->
					<target name="ExactGeometry" inputStreamId="authoring" outputStreamId="catiav5"  downloadable="false" conversionService="true">
					<!-- By default - ExactGeometry CXR25 CATPart AsResult this one is for PowerBy CATIAV5 
					           but one may prefer >=CXR31 to get associativiy (means a downward cATPart with stableId, allowinf rerouteLinks -->
						<parameter name="AdditionalFeatures"  values="GenericFeature" type="enum" default="GenericFeature" description="adjust the CATIA V5 level according to the needed features" />
					</target>
					<!-- CATPart for exchange from 23xFD04    from 24XBeta2, we also support DFC/OP case -->  
					<target name="CATPart" inputStreamId="authoring" outputStreamId="*"  downloadable="true"  conversionService="true" >
						<parameter name="level"  values="CATIAV5R18|CATIAV5R19|CATIAV5R20|CATIAV5R21|CATIAV5R22|CATIAV5R23|CATIAV5R24|CATIAV5R25|CATIAV5R26|CATIAV5R27|CATIAV5R28|CATIAV5R29|CATIAV5R30|CATIAV5R31|CATIAV5R32|CATIAV5R33|CATIAV5R34|CATIAV5R35|CATIAV5R36" type="enum" default="CATIAV5R31" description="the CATIA V5 level" mandatory="true" />
					</target>					

					<!-- V5 CGR DO from 24xFD04    conversion Native 3DEXP to V5 CGR (as a DO, without changing authoringVisu! --> 
					<target name="CGR" inputStreamId="authoringvisu" outputStreamId="cgrv5" downloadable="false" conversionService="true">
                    <!-- hardcoded parameter "V5Version"="CGRR19"
					 	<parameter name="CGR_Version" values="R19" type="enum" default="R19" mandatory="true" description="force V5 CGR (aka CGRR19)"/>  -->
					  <!-- parameter name="NO_WIREFRAME" values="true|false" type="enum" default="false" description="" / -->
					</target>
										
					
					<target name="PDF" inputStreamId="authoring" outputStreamId="PDF" downloadable="true" conversionService="true"/>
					<!-- For Conversion of CATPart with 2DLayout feature - No parameters required for Conversion  managed by CO from 25xFD01, -->
					<target name="ACIS" inputStreamId="authoring" outputStreamId="acis_powerby" downloadable="false" conversionService="true">
					    <!-- ACIS version is no longer a parameter for 'internal DS format', it s hard coded as version=26-->
					</target>
					<!-- New from 23xFD01 : 3DEXP to SDM (GEOVIA SURPAC) (and forward to CO from 23xFD02)  PowerBy format -->
					<target name="SurpacSDM" inputStreamId="authoring" outputStreamId="SurpacSDM" downloadable="false" conversionService="true">
						<parameter name="Extension" values="sdm" type="enum" default="sdm" description="" mandatory="true"/>
						<parameter name="StreamFormat" values="SurpacSDM" type="enum" default="SurpacSDM" description="" mandatory="true"/>
						<!-- add new parameters in 25xFD02 -->
						<parameter name="exportKnowledgeParameter" values="All|None" type="enum" default="All" description="Allows you to export the knowledge parameter of a feature as metadata" mandatory="true"/>
						<parameter name="exportSurpacObjectMode" values="GeometricalSet|GeometricalFeature" type="enum" default="GeometricalFeature" description="Allows you to export a single String or TriObject to group all the geometrical features aggregated under the same Geometrical Set. When it is not selected, each geometrical feature is exported in a separated String or triObject." mandatory="true"/>
						<parameter name="exportMagnitudeLength" values="Millimeter|Meter|Kilometer|Inch|Foot|Yard|Mile" type="enum" default="Meter" description="select a specific unit for export of Length magnitude." mandatory="true"/>
						<!-- add new parameters in 26xFD02 -->
						<parameter name="ExportOnlyShownEntities"  values="true|false" type="enum" default="true" 	description="" />
					</target>
					<!-- to come in some 26X late FD 
					<target name="OMF" inputStreamId="authoring" outputStreamId="OMF" downloadable="true" conversionService="true">
						<parameter name="Extension" values="sdm" type="enum" default="sdm" description="" mandatory="true"/>
					</target>
					-->
					
		            <!-- Need to add XCV   for 23XFD01 -->			
					<target name="xcvcore_zip" inputStreamId="authoring" outputStreamId="XCV" downloadable="false" conversionService="true" cloudOnly="true" >
						<parameter name="XCV_TRACE_LEVEL" values="NONE|LOW|MEDIUM|HIGH"  type="enum" default="NONE" description="traces level for the conversion"/>
						<parameter name="optimisedBoundingBox" values="true|false" type="enum" default="false" description="Smallest parallelepiped volume that contains the part"/>
					</target>
				</source>
				
				<source name="CATDrawing" type = "Drawing">
					<target name="PDF" inputStreamId="authoring" outputStreamId="*" downloadable="true" conversionService="true">
						<!-- PDF Parameters are coming from CATSettings on Converter Machine -->
						<!-- PDF parameters from 22xFD03 -->
						<parameter name="MultiSheetMode"    values="CURRENT|ALLIN1|ALLCURRENT1st" type="enum" default="CURRENT"  description="Define what sheets will the PDF includes" />
						<!-- NOT READY IN 22XFD03, reactivated in FD04 --> 
						<parameter name="ExcludeDetailSheet"   values="true|false"               type="enum" default="false"    description="Exclude the details sheets of the drawing in the PDF" />
						<parameter name="ColorMode"            values="RGB|GREYSCALE|MONO"       type="enum" default="RGB"      description="Color mode" />
						<parameter name="TextBlanking"         values="true|false"               type="enum" default="false"    description="Display the text blanking" />
						<parameter name="WhiteVectorsInBlack"  values="true|false"               type="enum" default="true"     description="Change the white vector in black to be seen on white background" />
						<!-- same as for STEP, the below mand param allows to compute the 'unified format (refinement from 'PDF'  -->
						<parameter name="PDFSaveMode"          values="PDF_1_3|PDF_A_1b|PDF_1_6" type="enum" default="PDF_1_3"  description="PDF version to use" mandatory="true"/>
					</target>

					<!-- new from 26xFD02 ...alternate generation from UDL in authoringVisu -->
					<target name="PDF" inputStreamId="authoringvisu" outputStreamId="*" downloadable="true" conversionService="true">
						<parameter name="MultiSheetMode"    values="CURRENT|ALLIN1|ALLCURRENT1st" type="enum" default="CURRENT"  description="Define what sheets will the PDF includes" />
						<parameter name="ExcludeDetailSheet"   values="true|false"               type="enum" default="false"    description="Exclude the details sheets of the drawing in the PDF" />
						<parameter name="ColorMode"            values="RGB|GREYSCALE|MONO"       type="enum" default="RGB"      description="Color mode" />
						<parameter name="TextBlanking"         values="true|false"               type="enum" default="false"    description="Display the text blanking" />
						<parameter name="WhiteVectorsInBlack"  values="true|false"               type="enum" default="true"     description="Change the white vector in black to be seen on white background" />